date,line,delay_reason,delay_duration,delay_duration_min,line_normalized,incident_type,resolutions_extracted,resolution_types,has_resolution,location_segment,location_station,location_direction,affected_trains_high_speed,affected_trains_intercity,affected_trains_regional,affected_trains_total,incident_time,time_of_day,day_of_week_num,day_of_week,is_weekend,is_holiday,is_high_speed_line,severity_score,embedding_text
2024-09-26,Palermo - Agrigento,"Via: RFI Palermo-Agrigento Line: from 8:35 am Rules to Return Round Return near Lercara branches after an inconvenience to the line. Update: 08:35 on the Palermo-Agrigento line, the railway circulation has returned regularly near Lercara branches after an inconvenience to the line. Effects on railway mobility :: 8 regional with slowdowns up to UTI, 3 limited regional and 2 canceled. Update: 07:35 on the Palermo-Agrigento line, railway circulation is slowed down near Lercara branches for an inconvenience to the line. Effects on railway mobility: slowdowns up to 35 minutes. The intervention of the RFI technicians is underway, updates will follow. Hours: 6:35 from 6:35 on the Palermo-Agrigento line, the railway circulation is slowed down near Lercara branches for an inconvenience to the line. Effects on railway mobility: slowdowns up to 35 minutes. The intervention of the RFI technicians is underway, updates will follow. To consult the updated monitors of departures/arrivals of your station click here.",40 min,40.0,Palermo - Agrigento,other,"[{'type': 'CANCEL'}, {'type': 'SPEED_REGULATE', 'duration_min': 35}]",CANCEL|SPEED_REGULATE,True,,Lercara branches,,0,0,8,8,8:35,morning_peak,4,Thursday,False,False,False,33.69,"other incident. on Palermo - Agrigento. near Lercara branches. causing 40 minutes delay. affecting 8 trains. resolved by cancel, speed regulate. during morning peak."
2024-09-27,Parma - La Spezia,"Notices of 27/09/2024 Trenitalia RFI Line: from 20:50 rail traffic suspended between Parma and Fornovo for adverse weather condition. 20:50 from 20:50 on the line, railway circulation is suspended between Parma and Fornovo for adverse weather conditions. The intervention of the RFI technicians and the firefighters is underway. Effects on railway mobility: trains will suffer limitations and cancellations, updates will follow. To consult the updated monitors of departures/arrivals of your station click here.",,,Parma - La Spezia,weather,[{'type': 'CANCEL'}],CANCEL,True,Parma - Fornovo for,,,0,0,0,0,20:50,night,5,Friday,False,False,False,0.0,weather incident. on Parma - La Spezia. between Parma - Fornovo for. resolved by cancel. during night.
2024-09-27,Brescia - Verona,"Via: RFI Line: from 9:23 pm Round Return railway circulation near Lonato after a technical inconvenience to the line. Update: 9:23 pm from 9:23 pm on the line the railway circulation, previously slowed down near Lonato for a technical inconvenience, has returned regular after the intervention of the RFI technicians who have restored the full functionality of the line. Effects on railway mobility: slowdowns up to Us for 4 high speed trains, 2 regional. Update: 9:00 pm on the line, the railway circulation remains slowed down near Lonato for a technical inconvenience to the line. The intervention of the RFI technicians continues. Effects on railway mobility: slowdowns up to 20 minutes, updates will follow. 19:55 from 19:55 on the line The railway circulation is slowed down near Lonato for a technical inconvenience to the line. The intervention of the RFI technicians is underway. Effects on railway mobility: slowdowns up to 20 minutes, updates will follow. To consult the updated monitors of departures/arrivals of your station click here.",15 min,15.0,Brescia - Verona,technical,"[{'type': 'SPEED_REGULATE', 'duration_min': 20}]",SPEED_REGULATE,True,,Lonato after,,4,0,2,6,9:23,morning_peak,5,Friday,False,False,False,26.93,technical incident. on Brescia - Verona. near Lonato after. causing 15 minutes delay. affecting 6 trains. resolved by speed regulate. during morning peak.
2024-09-27,High Speed ??Rome - Naples,"Via: RFI Line: from 17:30 Round Return Railway Circulation near S. Angelo after a technical inconvenience to a train. Update: 17:30 from 17:30 on the line the railway circulation has returned regular. Effects on railway mobility: slowdowns up to UBI for 15 high speed trains, up to 45 minutes for the previously faulty train. Update: 5:00 pm from 17:00 on the line, the railway circulation, previously slowed down near St. Angelo, is gradually resumed after the resolution of the technical inconvenience to the previously stopped train. Effects on railway mobility: trains will be able to slow down until UTI, updates will follow. 16:22 from 16:22 on the line, railway circulation is slowed down near St. Angelo for a technical inconvenience to a train. Technical checks in the train is underway. Effects on railway mobility: slowdowns up to 30 minutes, updates will follow. To consult the updated monitors of departures/arrivals of your station click here.",25 min,25.0,High Speed Rome - Naples,technical,"[{'type': 'SPEED_REGULATE', 'duration_min': 45}, {'type': 'GRADUAL_RECOVERY'}]",SPEED_REGULATE|GRADUAL_RECOVERY,True,,S,,15,0,0,15,17:30,evening_peak,5,Friday,False,False,True,44.56,"technical incident. on High Speed Rome - Naples. near S. causing 25 minutes delay. affecting 15 trains. resolved by speed regulate, gradual recovery. during evening peak."
2024-09-27,Castel Bolognese - Ravenna,Via: RFI Maltempo Emilia-Romagna: railway circulation suspended between Lugo and Russi. Update: 22 September 2024 - 06:00 on the line - the railway circulation remains suspended between Lugo and Russi following the wave of bad weather that affected the Region. The Italian railway network technicians are working for the monitoring of the infrastructure and for the interventions necessary for the reopening of the lines still closed. Further information on the websites of railway companies. To consult the updated monitors of departures/arrivals of your station click here.,,,Castel Bolognese - Ravenna,weather,[],,False,Lugo - Russi,,,0,0,0,0,,unknown,5,Friday,False,False,False,0.0,weather incident. on Castel Bolognese - Ravenna. between Lugo - Russi.
2024-09-27,Parma - La Spezia,"Via: RFI Line: from 09:25 Retailed railway circulation between Filattiera and Villafranca after the presence of branches on the tracks. Update: 09:25 on the line, the railway circulation has returned regularly between Filattiera and Villafranca after the presence of branches on the track. Effects on railway mobility: 2 regional with slowdowns up to use, 1 regional canceled and 3 limited. Update: 09:00 on the Parma line -the Spezia, the railway circulation remains suspended between Filattiera and Villafranca due to the presence of branches on the track. The intervention of the RFI technicians is underway, updates will follow effects on railway mobility: slowdowns, cancellations and variations. Hours: 7:30 from 7:30 on the Parma line -the Spezia, the railway circulation is suspended between Filattiera and Villafranca due to the presence of branches on the track. The intervention of the RFI technicians is underway, updates will follow effects on railway mobility: slowdowns, cancellations and variations. To consult the updated monitors of departures/arrivals of your station click here.",120 min,120.0,Parma - La Spezia,other,"[{'type': 'CANCEL'}, {'type': 'SPEED_REGULATE'}]",CANCEL|SPEED_REGULATE,True,Filattiera - Villafranca after,,,0,0,2,2,09:25,morning_peak,5,Friday,False,False,False,47.87,"other incident. on Parma - La Spezia. between Filattiera - Villafranca after. causing 120 minutes delay. affecting 2 trains. resolved by cancel, speed regulate. during morning peak."
2024-09-27,Unknown,"Via: RFI NODO of Milan: from 08:35 Round traffic Return regular between Milan Centrale and Milan Lambrate after the presence of unauthorized people near the tracks. Update: 08:35 on the Milan node, the railway circulation has returned regular between Milan Centrale and Milan Lambrate after the presence of unauthorized people near the tracks that led to the precautionary reduction in the speed in the section concerned. Effects on railway mobility: 7 high speed trains, 1 intercity and 12 regional with slowdowns until use. Hours: 08:05 from 08:05 on the Milan node, the railway circulation is slowed down between Milan Centrale and Milan Lambrate due to the presence of unauthorized people near the tracks that involves the precautionary reduction in the speed in the section concerned. An intervention by the police is underway to guarantee the resumption of railway traffic. Effects on railway mobility: slowdowns up to 20 minutes. Updates will follow. To consult the updated monitors of departures/arrivals of your station click here.",15 min,15.0,Unknown,trespasser,"[{'type': 'SPEED_REGULATE', 'duration_min': 20}]",SPEED_REGULATE,True,Milan Centrale - Milan Lambrate,the tracks,,7,1,12,20,08:35,morning_peak,5,Friday,False,False,False,35.33,trespasser incident. on Unknown. between Milan Centrale - Milan Lambrate. causing 15 minutes delay. affecting 20 trains. resolved by speed regulate. during morning peak.
2024-09-27,Florence - Bologna AV,"Via: RFI line Firenze-Bologna AV: from 9:35 am Returned Return railway circulation towards Florence near Bologna Centrale after a technical inconvenience on the line. Update: 09:35 am Railway circulation on the Florence-Bologna line Ave Direction Florence has returned regularly near Bologna Centrale after a technical inconvenience on the line. Effects on railway mobility: 15 high -speed trains with slowdowns to use. Update: 08:35 am Railway circulation on the Florence-Bologna line Ave direction Florence remains slowed down near Bologna Centrale due to a technical inconvenience on the line. Effects on railway mobility: slowdowns up to 30 minutes. The intervention of the RFI technicians is underway, updates will follow hours: 7:55 from 7:55 am Railway circulation on the Florence-Bologna line Ave direction Florence has slowed down near Bologna Centrale due to a technical inconvenience on the line. Effects on railway mobility: slowdowns up to 30 minutes. The intervention of the RFI technicians is underway, updates will follow to consult the updated monitors of departures/arrivals of your station click here.",15 min,15.0,Florence - Bologna AV,technical,"[{'type': 'SPEED_REGULATE', 'duration_min': 30}]",SPEED_REGULATE,True,,Bologna Centrale,Florence,0,0,0,0,9:35,morning_peak,5,Friday,False,False,False,23.33,technical incident. on Florence - Bologna AV. near Bologna Centrale. causing 15 minutes delay. resolved by speed regulate. during morning peak.
2024-09-27,Turin Milan AV,"Via: RFI Line: from 6:45 am Rulesa Returned Railway Circulation near Turin Stura after closing the maintenance works scheduled on the line. Update: 06:45 on the line, the railway circulation has returned regularly near Turin Stura after the closing of the maintenance works planned on the line. Effects on railway mobility: 2 high -speed trains sent in conventional line with a slowdown to use. Hours: 5:40 from 5:40 am on the line, the railway circulation is slowed down near Turin Stura for the prolongation of maintenance work on the line. RFI technicians are concluding maintenance activities to reactivate the line. Updates will follow effects on railway mobility: slowdowns up to 20 minutes. To consult the updated monitors of departures/arrivals of your station click here.",30 min,30.0,Turin Milan AV,maintenance,"[{'type': 'REROUTE'}, {'type': 'SPEED_REGULATE', 'duration_min': 20}]",REROUTE|SPEED_REGULATE,True,,Turin Stura,,0,0,0,0,6:45,morning_peak,5,Friday,False,False,False,26.67,"maintenance incident. on Turin Milan AV. near Turin Stura. causing 30 minutes delay. resolved by reroute, speed regulate. during morning peak."
2024-09-27,Rome - Florence AV,"Via: RFI line Rome - Florence AV: from 06:10 am Rules to Return Round between Capena and Welsh after an inconvenience to the line. Update: 06:10 on the Rome - Florence AV line, railway circulation has returned regular between Capena and Welsh after an inconvenience to the line. Effects on railway mobility: 4 high -speed and 1 regional trains with slowdowns up to UTI, 2 high -speed and 1 regional trains with slowdowns up to 10. Hours: 4:35 from 04:35 on the Rome - Florence AV line, the railway circulation has slowed between Capena and Gallese for an inconvenience to the line. Effects on railway mobility: slowdowns up to 30 minutes. The intervention of the RFI technicians is underway, updates will follow. To consult the updated monitors of departures/arrivals of your station click here.",40 min,40.0,Rome - Florence AV,other,"[{'type': 'SPEED_REGULATE', 'duration_min': 30}]",SPEED_REGULATE,True,Capena - Welsh after,,,0,0,1,1,06:10,morning_peak,5,Friday,False,False,False,29.49,other incident. on Rome - Florence AV. between Capena - Welsh after. causing 40 minutes delay. affecting 1 trains. resolved by speed regulate. during morning peak.
